{
  "schemaVersion": "1.0.0",
  "environment": {
    "node": "v24.14.1",
    "platform": "darwin",
    "architecture": "arm64",
    "logicalCpuCount": 18,
    "totalMemoryBytes": 137438953472
  },
  "method": {
    "runtime": "packages/react/src/table/TableController.ts",
    "warmupIterations": 3,
    "measuredIterations": 15,
    "clock": "performance.now"
  },
  "cases": [
    {
      "name": "stable public sort — 1k rows",
      "operation": "stable-sort",
      "rowCount": 1000,
      "samplesMs": [
        0.0355, 0.0301, 0.0317, 0.03, 0.0294, 0.0474, 0.2393, 0.0265, 0.0394, 0.0422, 0.0269,
        0.0346, 0.0272, 0.0268, 0.0261
      ],
      "summaryMs": {
        "minimum": 0.0261,
        "median": 0.0301,
        "p95": 0.2393,
        "maximum": 0.2393
      },
      "resultDigest": "sha256:7c0441b89fdc6aba3914f9b208bbc144df440fa09d4010e510376dd7d8100873"
    },
    {
      "name": "stable public sort — 10k rows",
      "operation": "stable-sort",
      "rowCount": 10000,
      "samplesMs": [
        0.2539, 0.4522, 0.2077, 0.2403, 0.2529, 0.2532, 0.3888, 0.2263, 0.2204, 0.2331, 0.232,
        0.3493, 0.2156, 0.2296, 0.2076
      ],
      "summaryMs": {
        "minimum": 0.2076,
        "median": 0.2331,
        "p95": 0.4522,
        "maximum": 0.4522
      },
      "resultDigest": "sha256:3ea8e47c54a61c4fc55d04c542f43402f71f7c066992eb13d05e9cc8fa81e553"
    }
  ]
}
